{
  "canonical_semantics_sha256": "a69c77755f7efab675c953f1e0ea8ccc11a86e332f9e623c15d22e713e405760",
  "corners": [],
  "deterministic_seed": 0,
  "generated_from": {
    "script": "render_r45_canonical_test.py",
    "version": "r45-canonical-test-renderer-v1"
  },
  "parameters": {},
  "profile_name": "canonical_test",
  "property_ids": [
    "P_SAMPLE_ON_RISING_SAMP",
    "P_ZERO_DELAY_OUTPUT_GROUP",
    "P_STAGGERED_DELAY_OUTPUT_GROUPS",
    "P_VOLTAGE_CODED_OUTPUT_LEVELS"
  ],
  "reuse_policy": "public_visible_and_final_trusted_replay_same_bytes",
  "schema_version": "r45-canonical-test-profile-v1",
  "simulator_options": {},
  "source": {
    "family_id": "181",
    "feedback_semantics_sha256": "a69c77755f7efab675c953f1e0ea8ccc11a86e332f9e623c15d22e713e405760",
    "harness_spec_sha256": "2b0bf3963155c8ffb5119b193b06f7c934f51cebad526275e7acb0542f05da4f",
    "schema_version": "v4-harness-spec-v1",
    "score_semantics_sha256": "a69c77755f7efab675c953f1e0ea8ccc11a86e332f9e623c15d22e713e405760",
    "task_id": "v4-181"
  },
  "test_deck_sha256": "7c99bd761f42f944a8c3b43c8a55e2a8b28befc7b1eb95084d0a4cf8f9314dc9"
}
