{
  "canonical_semantics_sha256": "939c5e8103ef5be0082831db535ba2a64386c7120dffd42b7216969d72a37fef",
  "corners": [],
  "deterministic_seed": 0,
  "generated_from": {
    "script": "render_r45_canonical_test.py",
    "version": "r45-canonical-test-renderer-v1"
  },
  "parameters": {},
  "profile_name": "canonical_test",
  "property_ids": [
    "P_POSITIVE_LO_GAIN_PATH",
    "P_NEGATIVE_LO_CHOP_PATH",
    "P_CONTINUOUS_TRACKING"
  ],
  "reuse_policy": "public_visible_and_final_trusted_replay_same_bytes",
  "schema_version": "r45-canonical-test-profile-v1",
  "simulator_options": {},
  "source": {
    "family_id": "196",
    "feedback_semantics_sha256": "939c5e8103ef5be0082831db535ba2a64386c7120dffd42b7216969d72a37fef",
    "harness_spec_sha256": "1ae4e113539a27a8a061d923f125e91eb28073880e59c63efc58a0b1db803a57",
    "schema_version": "v4-harness-spec-v1",
    "score_semantics_sha256": "939c5e8103ef5be0082831db535ba2a64386c7120dffd42b7216969d72a37fef",
    "task_id": "v4-196"
  },
  "test_deck_sha256": "240fb0efea3392b5d665af011d141eedad1ced9dbdc984c506110c30302ecca8"
}
